{
  "acceptance_contract_refs": [
    "schemas/acceptance_contract.schema.json"
  ],
  "base_ref": "main",
  "head_commit_sha": "86fa54fde1a6c6c8fa2692dd6b581b8a915d221d",
  "phase_id": "F00",
  "repository": "https://github.com/bqthai2310/HYAI",
  "requested_at": "2026-10-05T13:49:46.980952Z",
  "requested_by": {
    "id": "hermes",
    "principal_type": "EXECUTOR"
  },
  "review_request_id": "review_f00_86fa54fde1a6",
  "schema_version": "2.0.0"
}
